{
  "description": "the back-reference names the query's own client id",
  "kind": "request",
  "form": "list",
  "accountId": "acct-2",
  "limit": 1,
  "expect": {
    "request": {
      "using": [
        "urn:ietf:params:jmap:core",
        "urn:ietf:params:jmap:mail"
      ],
      "methodCalls": [
        [
          "Email/query",
          {
            "accountId": "acct-2",
            "sort": [
              {
                "property": "receivedAt",
                "isAscending": false
              }
            ],
            "collapseThreads": false,
            "limit": 1
          },
          "q"
        ],
        [
          "Email/get",
          {
            "accountId": "acct-2",
            "#ids": {
              "resultOf": "q",
              "name": "Email/query",
              "path": "/ids"
            },
            "properties": [
              "id",
              "blobId",
              "threadId",
              "subject",
              "from",
              "to",
              "cc",
              "receivedAt",
              "sentAt",
              "messageId",
              "hasAttachment",
              "preview",
              "attachments",
              "textBody",
              "bodyValues"
            ],
            "fetchTextBodyValues": true,
            "maxBodyValueBytes": 2048,
            "bodyProperties": [
              "partId",
              "blobId",
              "size",
              "name",
              "type",
              "disposition"
            ]
          },
          "e"
        ]
      ]
    }
  }
}
